{
  "product_id": "70000000-0000-4000-8000-000000000001",
  "mode": "STANDALONE",
  "roadmap_item_id": null,
  "keyword": "Loomit-SDK-panel",
  "title": "Loomit SDK compatibility panel",
  "description": {
    "schema_version": "1.0",
    "format": "MARKDOWN",
    "body": "Show installed and recommended Loomit SDK versions in App Details."
  },
  "risk_tier": "STANDARD",
  "gate_assignments": [
    { "gate_type": "PRD_APPROVAL", "approver_user_id": "30000000-0000-4000-8000-000000000002" },
    { "gate_type": "PLAN_APPROVAL", "approver_user_id": "30000000-0000-4000-8000-000000000003" },
    { "gate_type": "CODE_READINESS", "approver_user_id": "30000000-0000-4000-8000-000000000004" }
  ]
}
